{
  "command": "commit_candidate",
  "created_at": "2026-07-26T18:51:19Z",
  "expires_at": "2026-07-26T18:51:49Z",
  "instance_token": "0123456789abcdef0123456789abcdef",
  "payload": {
    "transaction_id": "tx-0001"
  },
  "protocol_version": "qlabs-reaper-ipc/1",
  "request_id": "valid-commit"
}
