{
  "command": "inspect_selection",
  "created_at": "2026-07-26T18:51:19Z",
  "expires_at": "2026-07-26T18:51:49Z",
  "instance_token": "0123456789abcdef0123456789abcdef",
  "payload": {
    "melody_extraction": {
      "mode": "auto"
    },
    "note_scope": "selected_or_all",
    "source_mode": "auto"
  },
  "protocol_version": "qlabs-reaper-ipc/1",
  "request_id": "valid-inspect-selection"
}
